Date Published,News Outlet,Title
2023-11-14T02:00:32Z,Fox News,SNL's Hamas joke in Timothée Chalamet skit infuriates pro-Palestinian voices online
2023-11-15T22:53:09Z,Fox News,"UK House of Commons votes against cease-fire amendment, over 50 labour lawmakers go against leader"
2023-11-15T15:02:34Z,Fox News,BBC News issues on-air apology for false claim Israel targeting staff and 'Arab speakers' at Gaza hospital
2023-11-15T18:39:56Z,Fox News,Netanyahu's wife writes Jill Biden a letter urging her to save 'suffering' Hamas child hostages
2023-11-14T13:38:14Z,Fox News,Democratic staffers revolt over bosses in Congress 'not listening' to constituents on Israel: Report
2023-11-14T02:22:14Z,Fox News,Northwestern University president calls on students to condemn antisemitic phrases; school group claps back
2023-11-15T11:39:41Z,Fox News,"Biden's China deal faces scrutiny, Tlaib ties to pro-Hamas Facebook group and more top headlines"
2023-11-15T01:12:44Z,Fox News,Massachusetts town approves permit to fly Palestinian flag on public flagpole
2023-11-14T00:28:38Z,Fox News,"Israeli peace activist identified after being kidnapped, killed by Hamas terrorists"
2023-11-15T02:53:58Z,Fox News,SEAN HANNITY: Hamas is just pure evil
2023-11-14T16:19:52Z,Fox News,Piers Morgan repeatedly asks Jeremy Corbyn if Hamas is terror group in tense exchange: 'Refusing to answer'
2023-11-14T23:05:56Z,Fox News,White House confirms Hamas terrorists using Gaza's largest hospital as operations base
2023-11-14T11:04:46Z,Fox News,November 14 | Israeli military beats back Hamas in Gaza as Biden calls for Shifa hospital to be protected
2023-11-15T11:35:47Z,Fox News,"Israel-Hamas war: Israeli forces encounter explosives, kill Hamas terrorists in operation at Gaza hospital"
2023-11-14T10:00:32Z,Fox News,Did China just kill peace in the Middle East?
2023-11-15T02:46:43Z,Fox News,George Washington University suspends SJP chapter after group projected 'Glory to our martyrs' onto building
2023-11-15T09:00:27Z,Fox News,"‘Squad’ member softening Israel rhetoric ahead of likely primary challenge might be ‘too little, too late’"
2023-11-14T10:00:42Z,Fox News,Israeli university president tours US campuses to urge action on growing antisemitism
2023-11-15T12:00:35Z,Fox News,"Right and left unite in support of Israel as Bush, Clinton confidants speak out against hate together"
2023-11-15T19:23:04Z,Fox News,Arrest warrant issued for Syrian leader's alleged use of banned chemical weapons: 'Butcher of Damascus'
2023-11-14T14:48:39Z,Fox News,GOP senator calls on Senate Dems to pass bipartisan House Israel aid bill again: 'Time is of the essence'
2023-11-15T21:19:47Z,Fox News,Biden's approval rating sinks over Israel-Hamas war; support for Trump in 2024 rises: poll
2023-11-14T20:36:57Z,Fox News,Liberal columnist slams anonymous Democrats undercutting bosses on Israel
2023-11-15T20:00:18Z,Fox News,"NYU hit with lawsuit for fueling 'virus of antisemitism,' 'abusing Jewish students with impunity'"
2023-11-15T23:00:54Z,Fox News,Former Harvard president takes a swipe at school for ‘not been swift’ in condemning ‘cancer’ of antisemitism
2023-11-14T20:52:05Z,Fox News,Pentagon confirms 55 attacks on US troops in Iraq and Syria since Oct. 17
2023-11-15T12:43:37Z,Fox News,2024 showdown: East Palestine leaders take sides in Ohio's Republican primary race
2023-11-15T15:01:12Z,Fox News,Hundreds honor Jewish man Paul Kessler killed in clash with pro-Palestinian protester: 'We want justice'
2023-11-14T19:30:44Z,Fox News,Senate Democrats block bipartisan House Israel aid bill
2023-11-14T11:00:56Z,Fox News,Former Iran hostage says Hamas shows how much Tehran 'exported their brand of Islamic terror'
2023-11-15T09:00:12Z,Fox News,House Homeland Chair Green to warn US is at 'one of the most dangerous times' in history during threat hearing
2023-11-15T12:00:40Z,Fox News,Rep. Jamaal Bowman takes heat for saying supporting a ceasefire is 'what it actually means to be Jewish'
2023-11-15T00:24:51Z,Fox News,Cornell University graduate student's union overwhelmingly votes to join union with strong anti-Israel ties
2023-11-15T21:19:23Z,Fox News,Fox News Politics: 'Squad' Dem's secret Facebook group
2023-11-15T23:00:14Z,Fox News,Fox News Poll: Support for helping Ukraine fading
2023-11-14T14:35:53Z,Fox News,"Happy birthday King Charles, Pope Francis embracing wokeness, and more from Fox News Opinion"
2023-11-14T17:47:39Z,Fox News,"Biden supports 'decent paying job' for 'average citizen in China,' but won't surrender US trade secrets"
2023-11-15T17:58:42Z,Fox News,FBI Director Wray says border gotaways a source of 'great concern' for agency
2023-11-15T16:19:05Z,Fox News,Critics slam Biden admin for waiver that gives Iran access to $10B fund: 'absolutely outrageous'
2023-11-14T23:19:55Z,Fox News,"Deadly California crash splits car in half, kills pedestrian on sidewalk"
2023-11-14T11:32:49Z,Fox News,"Israeli PM's warning to the West, sorority members expelled for trans member lawsuit and more top headlines"
2023-11-15T20:23:52Z,Fox News,"Nikki Haley walks back 'verify everybody' social media proposal, wants free speech for 'anonymous Americans'"
2023-11-14T20:57:43Z,Fox News,Fox News Politics: Congressional fisticuffs
2023-11-15T18:28:19Z,Fox News,US Navy destroyer shoots down drone from Yemen in the Red Sea
2023-11-14T07:00:04Z,Fox News,Deepfake AI images create new nightmares. Here are 5 ways we can cope
2023-11-14T09:00:08Z,Fox News,Samantha Woll murder: Why did Detroit police release suspect so soon after arrest?
2023-11-15T13:50:59Z,Fox News,Detroit-area Jews traveling to March for Israel stranded by alleged bus driver 'sick-out'
2023-11-15T11:00:51Z,Fox News,"Biden, Xi to meet on sidelines of APEC Conference in Bay Area: 'Intense diplomacy'"
2023-11-14T10:00:55Z,Fox News,"As he turns 75, gratitude to King Charles for championing these values at a time of crisis"
2023-11-15T10:00:28Z,Fox News,The root cause of the insanity on college campuses is older than you may think
2023-11-14T23:31:16Z,Fox News,US Catholic leaders urge global harmony at Baltimore gathering
2023-11-14T14:00:15Z,Fox News,"DOD says Russia, China will face 'similar consequences' to North Korea if illicit aid continues"
2023-11-14T20:36:45Z,Fox News,Former British home secretary Suella Braverman accuses PM Sunak of betraying promises in resignation letter
2023-11-15T21:30:33Z,Fox News,"Biden meets Xi, says there is 'no substitute' for 'face-to-face discussion' on issues facing US, China"
2023-11-15T19:41:11Z,Fox News,Senate expected to pass Speaker Johnson’s spending bill with support from Biden
2023-11-15T00:21:19Z,Fox News,"Gross reasons why you need to wash your new clothes, plus Thanksgiving turkey health tidbits"
2023-11-15T02:15:21Z,Fox News,Defense Department releases videos of 2 airstrikes Iranian proxies in Syria
2023-11-15T23:00:17Z,Fox News,Fox News Poll: Support for Trump hits 62% in GOP primary
2023-11-14T10:00:22Z,Fox News,Major law firm to accuse elite universities of civil rights violations for enabling antisemitic mobs
2023-11-14T13:45:45Z,Fox News,"Czech news crew covering APEC in San Francisco robbed, reports say"
2023-11-14T20:40:58Z,Fox News,The Hitchhiker’s Guide as to why tensions are running so high right now on Capitol Hill
2023-11-15T21:52:26Z,Fox News,"Jets' Robert Saleh explains Michael Carter's surprising release, vows more personnel changes to come"
2023-11-15T14:53:20Z,Fox News,Randi Weingarten fact checked for asking where the 'women' are at all-male Jewish prayer service
2023-11-16T16:23:29Z,Vice News,When You Face a Backlash For Speaking Out About Palestine
2023-11-16T17:17:09Z,Vice News,Israel Wanted Ground Offensive Before Hostage Deal: Sources
2023-11-16T18:07:17Z,Vice News,"Racist Premium X Users Exploiting Israel-Hamas War to Push Antisemitism, Islamophobia: Study"
2023-11-16T14:24:23Z,Vice News,The Far Right Is Loving Elon Musk's Comments About Jewish Groups Corrupting 'the West'
2023-11-16T17:27:05Z,Vice News,Russia Televises New Nuclear-Capable Hypersonic Missile Being Loaded Into Silo
2023-11-16T10:00:10Z,Fox News,Chicago college professor justifies Hamas attack 'after 75 years of Israeli White supremacy'
2023-11-15T23:00:20Z,Fox News,"Fox News Poll: Voters blame Hamas for war, continue to side with Israelis"
2023-11-16T12:19:25Z,Fox News,Biden says Israel will stop fighting in Gaza when Hamas 'no longer maintains the capacity to murder'
2023-11-16T08:00:35Z,Fox News,A capitol protest counters antisemitism as Israeli troops enter Gaza hospital
2023-11-16T18:08:42Z,Fox News,"Pro-Palestinian protesters block bridges in Boston, San Francisco during rush hour"
2023-11-16T02:00:57Z,Fox News,Yale dance group promotes fundraiser for ‘Palestinian anarchist fighters' on stage projection screen
2023-11-15T17:12:26Z,Fox News,Iranian official who reportedly helped Hamas plan Israel attack is seen shaking hands with UN aid leader
2023-11-15T21:15:01Z,Fox News,NYC Columbia University faculty and students protest suspension of 2 far-left groups
2023-11-15T17:33:03Z,Fox News,Comedian Jon Lovitz blasts HBO’s John Oliver for shaming U.S. over alliance with Israel: ‘God Bless America’
2023-11-16T15:14:03Z,Fox News,AOC leads two dozen Democrats calling for Israel ceasefire over 'violations against children' in Gaza
2023-11-16T20:06:40Z,Fox News,"New billboard across from the New York Times depicts kidnapped Israeli hostages, claims 'inaccurate reporting'"
2023-11-16T18:20:33Z,Fox News,UN official causes uproar over claim that Israel doesn't have right to defend itself against Hamas terrorists
2023-11-15T23:46:03Z,Fox News,US lets UN Security Council resolution calling for pauses in Gaza fighting pass without Hamas condemnation
2023-11-15T10:43:45Z,Fox News,Maryland middle school DEI teacher under investigation for Israel-Hamas comments: 'Hamas did not start this'
2023-11-16T18:06:22Z,Fox News,"Shelling ramps up at Israel-Lebanon border with Hezbollah, IDF trading missile strikes: report"
2023-11-16T19:20:53Z,Fox News,Kirby suggests it's unlikely Hamas' ideology will be eliminated
2023-11-16T10:00:59Z,Fox News,Arizona students allegedly bombarded with Hamas 'propaganda' in lesson claiming 'terrorist' is offensive term
2023-11-15T07:00:41Z,Fox News,'It’s my duty’: Demonstrators pack the National Mall in solidarity with Israel
2023-11-15T11:00:56Z,Fox News,Potential Israeli-Gaza hostage deal is evidence IDF is winning: top Netanyahu adviser
2023-11-15T00:30:29Z,Fox News,Professor who praised Hamas ‘resistance fighters’ on gliders no longer employed by Emory University
2023-11-15T09:00:56Z,Fox News,Rashida Tlaib member of secret Facebook group where Hamas terrorists glorified
2023-11-16T20:30:21Z,Fox News,"Democratic congressman calls out violent anti-Israel protesters, says some have been 'duped'"
2023-11-16T02:27:33Z,Fox News,Israeli soccer captain Eli Dasa shows shoe of boy kidnapped by Hamas on Oct. 7: 'We wait for him here'
2023-11-16T18:47:52Z,Fox News,Dem Senate hopeful urges Biden to drop out of 2024 race amid party infighting over Gaza
2023-11-15T19:20:23Z,Fox News,‘Will & Grace’ star Debra Messing blasted for speech at pro-Israel rally in DC
2023-11-16T08:45:09Z,Fox News,Woman vandalizes Israeli hostage posters right in front of captives' own family in New York City
2023-11-16T01:38:43Z,Fox News,"WATCH: Israel finds weapons, military equipment used by Hamas in key Gaza hospital after raid, IDF says"
2023-11-15T20:00:55Z,Fox News,"Ted Cruz goes off on alma mater Harvard, elite colleges: 'The Wuhan lab of the woke virus'"
2023-11-16T12:38:32Z,Fox News,"Israeli actress demands FBI probe funding, terror links of college groups 'brainwashing' American students"
2023-11-15T02:00:44Z,Fox News,"'March for Israel': Huge peaceful protest calls for release of hostages, end of antisemitism, Israeli victory"
2023-11-15T21:14:10Z,Fox News,Biden allies condemn far-left calls for cease-fire in Israel-Hamas war: 'Americans remain pro-Israel'
2023-11-15T12:34:16Z,Fox News,Israeli troops enter Al-Shifa Hospital after killing Hamas terrorists in gate-side firefight
2023-11-15T17:00:53Z,Fox News,Bipartisan lawmakers push Biden to investigate Hamas' cryptocurrency financing
2023-11-15T09:30:52Z,Fox News,"Social media giants feature far more pro-Palestinian content than pro-Israeli content, led by TikTok: expert"
2023-11-16T10:00:14Z,Fox News,BBC marred by recent string of retractions and apologies related to Israel-Hamas war coverage
2023-11-16T09:00:54Z,Fox News,Human rights lawyers says she has never seen 'such a rise in Jew hatred' after Hamas attacks in Israel
2023-11-15T14:00:46Z,Fox News,"Republican AGs rally to probe, prosecute groups with Hamas ties"
2023-11-16T13:27:44Z,Fox News,"Osama bin Laden's infamous 'Letter to America' after 9/11 promoted by TikTok influencers, goes viral"
2023-11-15T14:02:37Z,Fox News,Biden's favorite columnist urges him to use Trump's peace proposal for two-state solution: 'You sitting down?'
2023-11-16T09:00:37Z,Fox News,Republicans slam Tlaib over membership in secret Facebook group where Hamas was praised
2023-11-15T22:53:09Z,Fox News,"UK House of Commons votes against cease-fire amendment, over 50 labour lawmakers go against leader"
2023-11-16T19:52:25Z,Fox News,Franklin Graham's Samaritan's Purse sponsors 21 ambulances in Israel to replace those destroyed by Hamas
2023-11-15T15:02:34Z,Fox News,BBC News issues on-air apology for false claim Israel targeting staff and 'Arab speakers' at Gaza hospital
2023-11-15T18:39:56Z,Fox News,Netanyahu's wife writes Jill Biden a letter urging her to save 'suffering' Hamas child hostages
2023-11-15T11:39:41Z,Fox News,"Biden's China deal faces scrutiny, Tlaib ties to pro-Hamas Facebook group and more top headlines"
2023-11-15T01:12:44Z,Fox News,Massachusetts town approves permit to fly Palestinian flag on public flagpole
2023-11-16T18:46:11Z,Fox News,"Iran on 'execution spree' since start of Israel-Hamas war, killing 107 anti-regime activists, ethnic minority"
2023-11-15T02:53:58Z,Fox News,SEAN HANNITY: Hamas is just pure evil
2023-11-16T10:00:08Z,Fox News,The reason university efforts to root out antisemitism will fail
2023-11-16T05:43:02Z,Fox News,"Pro-Palestinian violent protest erupts outside DNC headquarters in Washington DC, Capitol police injured"
2023-11-16T00:27:02Z,Fox News,Tlaib refuses to answer reporter's questions on controversial phrase defined as ‘code for eradicating’ Israel
2023-11-16T19:02:59Z,Fox News,Pink Floyd's Roger Waters denied hotel reservations in South America after antisemitism accusations
2023-11-15T11:35:47Z,Fox News,"Israel-Hamas war: Israeli forces encounter explosives, kill Hamas terrorists in operation at Gaza hospital"
2023-11-16T16:56:23Z,Fox News,The Guardian removes Osama bin Laden's ‘Letter to America’ after TikTok influencers unearth pro-terror screed
2023-11-15T02:46:43Z,Fox News,George Washington University suspends SJP chapter after group projected 'Glory to our martyrs' onto building
2023-11-15T09:00:27Z,Fox News,"‘Squad’ member softening Israel rhetoric ahead of likely primary challenge might be ‘too little, too late’"
2023-11-15T12:00:35Z,Fox News,"Right and left unite in support of Israel as Bush, Clinton confidants speak out against hate together"
2023-11-15T19:23:04Z,Fox News,Arrest warrant issued for Syrian leader's alleged use of banned chemical weapons: 'Butcher of Damascus'
2023-11-16T11:23:33Z,Fox News,"DC pro-Palestinian protest turns violent, Senate averts shutdown, passes funding bill and more top headlines"
2023-11-15T21:19:47Z,Fox News,Biden's approval rating sinks over Israel-Hamas war; support for Trump in 2024 rises: poll
2023-11-16T11:05:00Z,Fox News,November 16 | UN calls for extended pause in Gaza as Israel dismantles Hamas leadership
2023-11-15T20:00:18Z,Fox News,"NYU hit with lawsuit for fueling 'virus of antisemitism,' 'abusing Jewish students with impunity'"
2023-11-16T21:57:55Z,Fox News,"Bin Laden letter trending shows education system failed Gen Z, can destroy US 'from within': critics"
2023-11-15T23:00:54Z,Fox News,Former Harvard president takes a swipe at school for ‘not been swift’ in condemning ‘cancer’ of antisemitism
2023-11-16T16:18:38Z,Fox News,Pro-Palestinian protester arrested in death of Jewish man Paul Kessler
2023-11-15T12:43:37Z,Fox News,2024 showdown: East Palestine leaders take sides in Ohio's Republican primary race
2023-11-15T15:01:12Z,Fox News,Hundreds honor Jewish man Paul Kessler killed in clash with pro-Palestinian protester: 'We want justice'
2023-11-15T09:00:12Z,Fox News,House Homeland Chair Green to warn US is at 'one of the most dangerous times' in history during threat hearing
2023-11-15T12:00:40Z,Fox News,Rep. Jamaal Bowman takes heat for saying supporting a ceasefire is 'what it actually means to be Jewish'
2023-11-16T14:50:30Z,Fox News,"Massachusetts town flying Palestinian flag sparks backlash from residents, Jewish congregation"
2023-11-16T19:38:21Z,Fox News,"Prestigious universities plagued by antisemitism receive billions in taxpayer-backed cash, analysis finds"
2023-11-15T00:24:51Z,Fox News,Cornell University graduate student's union overwhelmingly votes to join union with strong anti-Israel ties
2023-11-15T21:19:23Z,Fox News,Fox News Politics: 'Squad' Dem's secret Facebook group
2023-11-16T21:30:44Z,Fox News,Groups fear faculty that defended Hamas could set California standards: 'Institutionalization of antisemitism’
2023-11-16T12:25:37Z,Fox News,"Driver rams barrier near Israeli embassy in Tokyo, injures police officer"
2023-11-15T23:00:14Z,Fox News,Fox News Poll: Support for helping Ukraine fading
2023-11-16T03:04:37Z,Fox News,DeSantis trolls Nikki Haley with new campaign merch mocking her comments about social media verification
2023-11-16T00:39:04Z,Fox News,Texas bishop ousted by Pope rallies outside US bishops meeting as they reinforce Catholic voter values
2023-11-15T17:58:42Z,Fox News,FBI Director Wray says border gotaways a source of 'great concern' for agency
2023-11-15T16:19:05Z,Fox News,Critics slam Biden admin for waiver that gives Iran access to $10B fund: 'absolutely outrageous'
2023-11-16T15:52:28Z,Fox News,"Dan Santat, Justin Torres, Ned Blackhawk among winners of the 2023 National Book Awards"
2023-11-16T20:20:01Z,Fox News,Judge in Trump's Georgia election interference case orders 'sensitive' evidence withheld from public
2023-11-16T23:00:01Z,Fox News,"Fox News Poll: 78% rate economy negatively, and majority says worst isn’t over"
2023-11-16T09:00:14Z,Fox News,"Wray warns lone actors 'inspired' by foreign terrorists, radicalized online are 'greatest threat' to US"
2023-11-16T20:50:24Z,Fox News,'The View' co-host warns TikTok is 'creating a radical young movement' in the US
2023-11-15T20:23:52Z,Fox News,"Nikki Haley walks back 'verify everybody' social media proposal, wants free speech for 'anonymous Americans'"
2023-11-15T18:28:19Z,Fox News,US Navy destroyer shoots down drone from Yemen in the Red Sea
2023-11-16T22:02:16Z,Fox News,"Iranian proxies continue targeting US troops in Syria and Iraq, with a total of 58 since Oct. 17: Pentagon"
2023-11-15T13:50:59Z,Fox News,Detroit-area Jews traveling to March for Israel stranded by alleged bus driver 'sick-out'
2023-11-16T22:47:15Z,Fox News,Georgia Republicans dunk on voting law critics after MLB all-star game returns to Atlanta
2023-11-16T23:00:03Z,Fox News,"Fox News Poll: Republicans preferred on top issues such as inflation, security"
2023-11-15T11:00:51Z,Fox News,"Biden, Xi to meet on sidelines of APEC Conference in Bay Area: 'Intense diplomacy'"
2023-11-15T10:00:28Z,Fox News,The root cause of the insanity on college campuses is older than you may think
2023-11-16T17:05:36Z,Fox News,Republicans blast pro-Palestinian protests at DNC: 'Nation's capital is under siege'
2023-11-16T16:52:03Z,Fox News,Biden reveals who he thinks 'could have the job' he's running for as 2024 'shadow campaign' rumors swirl
2023-11-17T18:01:15Z,Vice News,Protesters Are Targeting Defense Contractors That Bragged About Profits from Gaza
2023-11-16T16:23:29Z,Vice News,When You Face a Backlash For Speaking Out About Palestine
2023-11-16T17:17:09Z,Vice News,Israel Wanted Ground Offensive Before Hostage Deal: Sources
2023-11-17T15:41:39Z,Vice News,"A Century-Old, Debunked Theory Is Fueling the TikTok Moral Panic"
2023-11-16T18:07:17Z,Vice News,"Racist Premium X Users Exploiting Israel-Hamas War to Push Antisemitism, Islamophobia: Study"
2023-11-16T14:24:23Z,Vice News,The Far Right Is Loving Elon Musk's Comments About Jewish Groups Corrupting 'the West'
2023-11-16T17:27:05Z,Vice News,Russia Televises New Nuclear-Capable Hypersonic Missile Being Loaded Into Silo
2023-11-16T10:00:10Z,Fox News,Chicago college professor justifies Hamas attack 'after 75 years of Israeli White supremacy'
2023-11-16T12:19:25Z,Fox News,Biden says Israel will stop fighting in Gaza when Hamas 'no longer maintains the capacity to murder'
2023-11-17T12:27:24Z,Fox News,Netanyahu: Israel 'not successful' in minimizing Gaza civilian casualties
2023-11-16T08:00:35Z,Fox News,A capitol protest counters antisemitism as Israeli troops enter Gaza hospital
2023-11-16T18:08:42Z,Fox News,"Pro-Palestinian protesters block bridges in Boston, San Francisco during rush hour"
2023-11-16T02:00:57Z,Fox News,Yale dance group promotes fundraiser for ‘Palestinian anarchist fighters' on stage projection screen
2023-11-17T18:34:29Z,Fox News,Birthplace of Jesus dismantling all Christmas decorations 'in solidarity with our people in Gaza'
2023-11-17T13:00:05Z,Fox News,NY Times Magazine poetry editor resigns in protest of Israel's 'US-backed war against the people of Gaza'
2023-11-16T15:14:03Z,Fox News,AOC leads two dozen Democrats calling for Israel ceasefire over 'violations against children' in Gaza
2023-11-16T20:06:40Z,Fox News,"New billboard across from the New York Times depicts kidnapped Israeli hostages, claims 'inaccurate reporting'"
2023-11-16T18:20:33Z,Fox News,UN official causes uproar over claim that Israel doesn't have right to defend itself against Hamas terrorists
2023-11-16T18:06:22Z,Fox News,"Shelling ramps up at Israel-Lebanon border with Hezbollah, IDF trading missile strikes: report"
2023-11-16T19:20:53Z,Fox News,Kirby suggests it's unlikely Hamas' ideology will be eliminated
2023-11-16T10:00:59Z,Fox News,Arizona students allegedly bombarded with Hamas 'propaganda' in lesson claiming 'terrorist' is offensive term
2023-11-17T02:23:11Z,Fox News,Pro-Palestinian group posts NYC map of locations 'tied' to 'Genocide' in Gaza: 'Globalize the Intifada'
2023-11-17T13:45:44Z,Fox News,LA Times suspends reporters who signed letter ripping Israel from covering war: Report
2023-11-17T18:25:49Z,Fox News,IDF finds stash of mortar shells next to kindergarten classroom in Gaza
2023-11-16T20:30:21Z,Fox News,"Democratic congressman calls out violent anti-Israel protesters, says some have been 'duped'"
2023-11-16T02:27:33Z,Fox News,Israeli soccer captain Eli Dasa shows shoe of boy kidnapped by Hamas on Oct. 7: 'We wait for him here'
2023-11-16T18:47:52Z,Fox News,Dem Senate hopeful urges Biden to drop out of 2024 race amid party infighting over Gaza
2023-11-16T08:45:09Z,Fox News,Woman vandalizes Israeli hostage posters right in front of captives' own family in New York City
2023-11-16T01:38:43Z,Fox News,"WATCH: Israel finds weapons, military equipment used by Hamas in key Gaza hospital after raid, IDF says"
2023-11-17T09:00:48Z,Fox News,"Israeli girl spends 9th birthday in 'tunnels of Gaza,' with 'no friends, 'no light,' says distraught father"
2023-11-16T12:38:32Z,Fox News,"Israeli actress demands FBI probe funding, terror links of college groups 'brainwashing' American students"
2023-11-17T21:59:02Z,Fox News,Turkey's Erdogan to visit Germany as differences over the Israel-Hamas war widen
2023-11-16T10:00:14Z,Fox News,BBC marred by recent string of retractions and apologies related to Israel-Hamas war coverage
2023-11-17T18:30:32Z,Fox News,DeSantis hit with lawsuit over deactivation of University of Florida pro-Palestinian group
2023-11-16T09:00:54Z,Fox News,Human rights lawyers says she has never seen 'such a rise in Jew hatred' after Hamas attacks in Israel
2023-11-16T13:27:44Z,Fox News,"Osama bin Laden's infamous 'Letter to America' after 9/11 promoted by TikTok influencers, goes viral"
2023-11-16T09:00:37Z,Fox News,Republicans slam Tlaib over membership in secret Facebook group where Hamas was praised
2023-11-17T12:57:42Z,Fox News,Fox News ‘Antisemitism Exposed’ Newsletter: Girl spends 9th birthday hostage as colleges' dark pasts revealed
2023-11-16T19:52:25Z,Fox News,Franklin Graham's Samaritan's Purse sponsors 21 ambulances in Israel to replace those destroyed by Hamas
2023-11-17T04:46:40Z,Fox News,Texas parents say teacher singled out Israeli daughter to make pro-Palestinian comment
2023-11-17T14:55:33Z,Fox News,Tempers flare on MSNBC as Mehdi Hasan argues with Israeli official: Your government ‘killed children’
2023-11-17T21:19:46Z,Fox News,New York prosecutor drops charges against GOP councilwoman who brought gun to protest in support of Israel
2023-11-16T18:46:11Z,Fox News,"Iran on 'execution spree' since start of Israel-Hamas war, killing 107 anti-regime activists, ethnic minority"
2023-11-17T17:50:08Z,Fox News,Left-wing comedian Michael Rapaport says voting for Trump ‘on the table’ if antisemitism not addressed in US
2023-11-16T10:00:08Z,Fox News,The reason university efforts to root out antisemitism will fail
2023-11-16T05:43:02Z,Fox News,"Pro-Palestinian violent protest erupts outside DNC headquarters in Washington DC, Capitol police injured"
2023-11-17T09:30:09Z,Fox News,'Target on my back:’ Fear grips Jewish students as hundreds protest Columbia suspending Palestinian groups
2023-11-16T00:27:02Z,Fox News,Tlaib refuses to answer reporter's questions on controversial phrase defined as ‘code for eradicating’ Israel
